[
  {
    "id": "global",
    "label": "전체 검색 (모든 문서)",
    "type": "global",
    "path": "",
    "scope": "global",
    "policy": ""
  },
  {
    "id": "meeting-default",
    "label": "녹음/회의 자료",
    "type": "meeting",
    "path": "~/Desktop/AI Summary/녹음",
    "scope": "policy",
    "policy": "core/config/meeting_agent.yaml"
  },
  {
    "id": "documents-docs",
    "label": "문서 자료 (Documents)",
    "type": "documents",
    "path": "/Users/david/Documents",
    "scope": "policy",
    "policy": "core/config/hybrid.yaml"
  },
  {
    "id": "documents-desktop",
    "label": "문서 자료 (Desktop)",
    "type": "documents",
    "path": "/Users/david/Desktop",
    "scope": "policy",
    "policy": "core/config/hybrid.yaml"
  },
  {
    "id": "documents-downloads",
    "label": "문서 자료 (Downloads)",
    "type": "documents",
    "path": "/Users/david/Downloads",
    "scope": "policy",
    "policy": "core/config/hybrid.yaml"
  },
  {
    "id": "documents-cloud",
    "label": "문서 자료 (CloudStorage)",
    "type": "documents",
    "path": "/Users/david/Library/CloudStorage",
    "scope": "policy",
    "policy": "core/config/hybrid.yaml"
  },
  {
    "id": "photos-default",
    "label": "사진 자료",
    "type": "photos",
    "path": "~/Desktop/AI Summary/사진",
    "scope": "policy",
    "policy": "core/config/hybrid.yaml"
  }
]
